{
  "schema_version": "v1",
  "response_type": "document_catalog_page",
  "request_id": "99999999-9999-4999-8999-999999999999",
  "tenant_id": "11111111-1111-4111-8111-111111111111",
  "items": [
    {
      "document_id": "23232323-2323-4232-8232-232323232323",
      "source_id": "12121212-1212-4121-8121-121212121212",
      "title": "Manual declarado para revision",
      "document_type": "manual",
      "document_scope": "municipal",
      "issuing_authority": "Municipalidad de Mixco",
      "official_source": false,
      "document_status": "draft",
      "confidentiality": "public",
      "registered_by_principal_id": "33333333-3333-4333-8333-333333333333",
      "created_at": "2026-07-21T23:00:00.000Z",
      "updated_at": "2026-07-21T23:00:00.000Z",
      "version": {
        "document_version_id": "34343434-3434-4343-8343-343434343434",
        "version_label": "discovery-2026-07",
        "source_url": "https://www2.munimixco.gob.gt/documentos/manual.pdf",
        "original_filename": "manual.pdf",
        "mime_type": "application/pdf",
        "content_sha256": "aaaaaaaaaaaaaaaaaaaaaaaaaaaaaaaaaaaaaaaaaaaaaaaaaaaaaaaaaaaaaaaa",
        "page_count": null,
        "extraction_state": "queued",
        "created_at": "2026-07-21T23:00:00.000Z"
      },
      "artifact_acceptance": {
        "state": "not_accepted",
        "artifact_object_id": null,
        "artifact_scan_id": null,
        "accepted_until": null
      },
      "ingestion_state": "not_started",
      "retrieval_state": "not_indexed"
    }
  ],
  "next_cursor": null,
  "provenance": {
    "source_product": "la_muni_rag",
    "generated_by": "system",
    "created_at": "2026-07-21T23:00:00.000Z",
    "source_refs": [
      "23232323-2323-4232-8232-232323232323"
    ],
    "credential_id": "66666666-6666-4666-8666-666666666666",
    "audit_id": "abababab-abab-4bab-8bab-abababababab"
  }
}
